{"schema_version":"1","id":"evt_00000000000000000000000000000001","kind":"agent.delta","time":"2026-10-16T05:00:00Z","app":"agent-wrapper","session_id":"ses_00000000000000000000000000000001","turn_id":"turn_1","sequence":7,"process":{"pid":4242,"provider":"claude","runtime":"streaming-stdio"},"source":{"channel":"claude-stream-json","confidence":"exact"},"payload":{"content":"hello","block_id":"b1","phase":"final"}}
